{
  "schema_version": 1,
  "registry_id": "life-engineering-root-cause-repairs-v1",
  "runtime_control_authority": "NONE",
  "repairs": [
    {
      "repair_id": "RCA-0001",
      "root_goal_ref": "continuity/current.json:A-0014",
      "state": "VERIFIED_FIXED",
      "failure_refs": [
        "github-actions:34745411071:test_issue_lifecycle.IssueLifecycleTests.test_terminal_operations_are_derived_from_canonical_admissions",
        "github-actions:34745411071:test_watchdog.WatchdogValidationTests.test_canonical_package_validates"
      ],
      "violated_invariant_ids": [
        "MUTABLE_CANONICAL_STATE_NOT_LITERAL_TEST_EXPECTATION",
        "DERIVED_SOURCE_COMPATIBILITY_NOT_MANUALLY_REFRESHED_COPY"
      ],
      "origin_commit_refs": [
        "87316f8c1194cbd90f6891ee3f7fd7e3a362862d",
        "4ee657922c4597ca10e2f2de95721e0f26bd29d8"
      ],
      "history_evidence_refs": [
        "736243d9497a244709aaef0225a7cc38fbbcd7dc",
        "e9806a01c580638b6b287d45ec37163af479b5c3",
        "a4516d5f0c2a64763b527f55198a4c900f13dec8",
        "75bcf4ad3a16cb4c37373c7e11e8f8a9811e92bf",
        "76f52a8112bf916d49171806b4da4c8d141a9cdd",
        "22f8c916fb7f3e8f429a28bb9e7a73de1bc78dd5"
      ],
      "root_cause_classes": [
        "PRODUCTION_STATE_USED_AS_TEST_FIXTURE_WITH_LITERAL_EXPECTATION",
        "MANUALLY_MAINTAINED_DERIVED_SOURCE_IDENTITY",
        "SOURCE_DEPENDENCY_CLOSURE_NOT_EXECUTABLY_MODELED"
      ],
      "affected_surfaces": [
        "tests/test_issue_lifecycle.py",
        "tests/test_work_selection.py",
        "watchdog/spec.json",
        "scripts/validate_watchdog.py",
        "tests/test_watchdog.py",
        "continuity/bootstrap.json"
      ],
      "dependent_validator_surfaces": [
        "scripts/validate_issue_lifecycle.py",
        "scripts/validate_watchdog.py",
        "scripts/validate_continuity.py",
        ".github/workflows/continuity.yml"
      ],
      "selected_dispositions": [
        "REPLACE_LITERAL_PRODUCTION_EXPECTATIONS_WITH_CONTROLLED_FIXTURE_ASSERTIONS",
        "REPLACE_STATIC_SOURCE_FINGERPRINT_COPY_WITH_CURRENT_TREE_STRUCTURAL_COMPATIBILITY_VALIDATION",
        "COMBINE_ROOT_CAUSE_POLICY_WITH_EXISTING_REQUIRED_VALIDATION_AND_FUTURE_PROBLEM_INTAKE"
      ],
      "recurrence_test_ids": [
        "ISSUE_LIFECYCLE_FIXTURE_ACCEPTS_NEW_TERMINAL_ITEMS_WITHOUT_LITERAL_UPDATE",
        "WATCHDOG_BOOTSTRAP_NONAUTHORITY_CHANGE_DOES_NOT_REQUIRE_HASH_REFRESH",
        "WATCHDOG_AUTHORITY_OR_IDENTITY_DRIFT_FAILS_STRUCTURAL_COMPATIBILITY",
        "ROOT_CAUSE_POLICY_FORBIDS_PATCH_ONLY_TERMINAL_SHORTCUT"
      ],
      "verification_state": "VERIFIED_REQUIRED_CI_PROTECTED_INTEGRATION_AND_LIVE_READBACK"
    },
    {
      "repair_id": "RCA-0002",
      "root_goal_ref": "continuity/current.json:A-0014",
      "state": "VERIFIED_FIXED",
      "failure_refs": [
        "github-actions:34748616720:validate_lock_history",
        "github-actions:34749147069:Validate lock history",
        "github-lock-branch:lock/385ed47b5d7856779a9bc5c28f34b7cb80424b4b567bb054eb6ea16ecc909aab",
        "github:lock/385ed47b5d7856779a9bc5c28f34b7cb80424b4b567bb054eb6ea16ecc909aab:TRANSIENT_EMPTY_REF",
        "github-actions:34784711860:Validate relevant lock history",
        "github-actions:34784868142:Validate source coordination"
      ],
      "violated_invariant_ids": [
        "DISJOINT_RESOURCE_DEFECT_MUST_NOT_CREATE_GLOBAL_MERGE_BLOCKER",
        "REQUIRED_LOCK_HISTORY_GATE_MUST_VALIDATE_CURRENT_WORK_CLAIMS",
        "FIRST_VISIBLE_LOCK_REF_CONTAINS_GENERATION_ONE_SNAPSHOT",
        "GLOBAL_LOCK_HISTORY_VALIDATION_NOT_RACY_WITH_NEW_ACQUISITION",
        "CLAIM_OWNERSHIP_IS_RESOURCE_KEY_WORK_ID_LEASE_ID_GENERATION",
        "REPOSITORY_PATHS_ARE_RECORDED_EXACTLY_IN_THE_WORK_RECORD"
      ],
      "origin_commit_refs": [
        "97b3c9d8f9a5ebda5b28752caebb2078935101c2",
        "c19aa46023c4597ca10e2f2de95721e0f26bd29d8",
        "634e20f875b83d502c42625226263e619aa4a929"
      ],
      "history_evidence_refs": [
        "60bf80bef57154b0639d2f5328917b22bc425935",
        "0b2611fba37f8b4cb44574264c1463e2d1366126",
        "634e20f875b83d502c42625226263e619aa4a929",
        "0a53782fa5ad2a16bb384e5a81116da1c1cfe296",
        "e3df5efb44475afd702d2744dedce7634dc76625",
        "cf9ea647919f13eeac673a6cf97838f54702f228",
        "403b3a0edd0935f2ada089221a0801c35f44ea0b",
        "c15b38be3150a3cf2b75fd47eec92ae1ee2acefe",
        "ef5f7857e8e7b967adde10b7199cd62a7faafe87"
      ],
      "root_cause_classes": [
        "GLOBAL_LIVE_NAMESPACE_VALIDATION_CONTRADICTS_EXACT_RESOURCE_INTERSECTION",
        "INTERRUPTED_TWO_STEP_LOCK_ACQUISITION_CAN_LEAVE_EMPTY_LOCK_REF",
        "LOCK_REF_PUBLISHED_BEFORE_FIRST_LOCK_SNAPSHOT",
        "DETECTOR_AND_ACQUISITION_PROTOCOL_NOT_CLOSED_UNDER_CONCURRENCY",
        "LEASE_TRANSITION_VALIDATOR_CONFLATED_DURABLE_WORK_ID_WITH_LEASE_CYCLE",
        "REPAIR_PATH_DECLARATION_LAGGED_SOURCE_MUTATION"
      ],
      "affected_surfaces": [
        ".github/workflows/continuity.yml",
        "scripts/validate_lock_history.py",
        "scripts/validate_relevant_lock_history.py",
        "tests/test_lock_history.py",
        "tests/test_relevant_lock_history.py",
        "coordination/protocol.json",
        "coordination/README.md",
        "tests/test_initial_lock_publication.py",
        "governance/root-cause-repairs.json"
      ],
      "dependent_validator_surfaces": [
        ".github/workflows/continuity.yml",
        "scripts/validate_coordination.py",
        "scripts/validate_lock_history.py",
        "scripts/validate_relevant_lock_history.py",
        "tests/test_lock_history.py"
      ],
      "selected_dispositions": [
        "KEEP_STRICT_GLOBAL_LOCK_HISTORY_VALIDATOR_AS_EXPLICIT_AUDIT",
        "REPLACE_REQUIRED_CI_GLOBAL_SCAN_WITH_CHANGED_WORK_CLAIM_HISTORY_SCOPE",
        "KEEP_EMPTY_REFERENCED_LOCK_BRANCH_REJECTION",
        "KEEP_POST_EPOCH_EMPTY_LOCK_BRANCH_REJECTION",
        "MODIFY_FIRST_ACQUISITION_TO_PREBUILD_LOCK_COMMIT_BEFORE_REF_PUBLICATION",
        "COMBINE_ATOMIC_FIRST_PUBLICATION_WITH_EXISTING_COMPARE_AND_SWAP_TRANSITIONS",
        "MODIFY_LOCK_HISTORY_TRANSITIONS_TO_ALLOW_DURABLE_WORK_ID_REUSE_WITH_FRESH_LEASE_AND_GENERATION",
        "KEEP_FRESH_LEASE_ID_AND_EXACT_GENERATION_INCREMENT",
        "MODIFY_COORDINATION_README_TO_MATCH_EXECUTABLE_TRANSITION_SEMANTICS",
        "MODIFY_WORK_RECORD_BEFORE_FINAL_VALIDATION_TO_COVER_ALL_REPAIR_PATHS"
      ],
      "recurrence_test_ids": [
        "UNRELATED_EMPTY_LOCK_BRANCH_DOES_NOT_ENTER_CURRENT_WORK_REQUIRED_GATE",
        "REFERENCED_EMPTY_LOCK_BRANCH_STILL_FAILS_CLOSED",
        "GLOBAL_AUDIT_STILL_REJECTS_POST_EPOCH_EMPTY_LOCK_BRANCH",
        "PULL_REQUEST_SCOPE_DERIVES_FROM_EXACT_EVENT_BASE_AND_HEAD",
        "PROTOCOL_REQUIRES_PREBUILT_GENERATION_ONE_LOCK_COMMIT",
        "PROTOCOL_FORBIDS_VISIBLE_EMPTY_POST_EPOCH_LOCK_REF",
        "POST_EPOCH_EMPTY_LOCK_BRANCH_DETECTOR_REMAINS_FAIL_CLOSED",
        "SAME_WORK_RELEASE_REACQUISITION_WITH_NEW_LEASE_IS_VALID",
        "SAME_WORK_POST_EXPIRY_TAKEOVER_WITH_NEW_LEASE_IS_VALID",
        "REACQUISITION_REUSED_LEASE_STILL_FAILS",
        "TAKEOVER_REUSED_LEASE_STILL_FAILS"
      ],
      "verification_state": "VERIFIED_REQUIRED_CI_PROTECTED_INTEGRATION_AND_LIVE_READBACK"
    },
    {
      "repair_id": "RCA-0003",
      "root_goal_ref": "continuity/current.json:A-0014",
      "state": "VERIFIED_FIXED",
      "failure_refs": [
        "github-actions:34783372915:tests.test_continuity.ContinuityTests.test_bootstrap_loads_goal_lifecycle_before_work_selection",
        "github-actions:34784818909:test_root_cause_repair.RootCauseRepairTests.test_canonical_package_validates:RCA-0003-disposition-invalid"
      ],
      "violated_invariant_ids": [
        "MUTABLE_CANONICAL_STATE_NOT_LITERAL_TEST_EXPECTATION"
      ],
      "origin_commit_refs": [
        "2bf2028963f66ba122d29102a23018da42265883"
      ],
      "history_evidence_refs": [
        "2bf2028963f66ba122d29102a23018da42265883",
        "ba6b112a46bcc75cbd14c53e26f36a96de29d37e",
        "3f0298c84670c9b0f67ac2c5c1ae4fc637c795ad"
      ],
      "root_cause_classes": [
        "PRODUCTION_STATE_USED_AS_TEST_FIXTURE_WITH_LITERAL_EXPECTATION"
      ],
      "affected_surfaces": [
        "continuity/bootstrap.json",
        "continuity/schema/bootstrap.schema.json",
        "governance/root-cause-repairs.json",
        "tests/test_continuity.py"
      ],
      "dependent_validator_surfaces": [
        ".github/workflows/continuity.yml",
        "scripts/validate_continuity.py",
        "scripts/validate_root_cause_repair.py",
        "tests/test_root_cause_repair.py"
      ],
      "selected_dispositions": [
        "REPLACE_LITERAL_PRODUCTION_EXPECTATION_WITH_SCHEMA_DERIVED_ASSERTION",
        "COMBINE_VERSION_INCREMENT_FALSIFICATION_WITH_SCHEMA_VALIDATION"
      ],
      "recurrence_test_ids": [
        "BOOTSTRAP_BUNDLE_VERSION_SCHEMA_DERIVED",
        "BOOTSTRAP_BUNDLE_VERSION_INCREMENT_ACCEPTED"
      ],
      "verification_state": "VERIFIED_REQUIRED_CI_PROTECTED_INTEGRATION_AND_LIVE_READBACK"
    }
  ]
}
